{"name":"Seasonal integration fixture","flag":"-o","threshold":1,"require_unique":false,"hide_activation_message":true,"items":["minecraft:apple"],"effects":[{"duration_type":"until_death","effect_type":"mob_effect","effect_id":"minecraft:speed","conditions":{"logic":"AND","temperature":{"min":-100,"max":100},"cold_sweat_state":"freezing","season":"winter"}},{"duration_type":"fixed","effect_type":"mob_effect","effect_id":"minecraft:regeneration","duration_ticks":100,"conditions":{"logic":"AND","season":"winter"}},{"duration_type":"until_death","effect_type":"health","effect_id":"health","value":2,"conditions":{"logic":"OR","temperature":{"min":100},"season":"winter"}}]}
