{
  "name": "Сладкоежка",
  "advancement": "offseason:offseason_tab/bonus_sweet_tooth",
  "active_effect_text": "Один сахар...",
  "flag": "-c",
  "threshold": 10,
  "hide_activation_message": false,
  "require_unique": true,
  "tooltip_icon": "🍭",
  "tooltip_icon_color": "light_purple",
  "items": [
    "fruitsdelight:lemon_cookie",
    "fruitsdelight:persimmon_cookie",
    "farmersdelight:honey_cookie",
    "farmersdelight:sweet_berry_cookie",
    "endersdelight:uncanny_cookies",
    "farmersrespite:green_tea_cookie",
    "fruitsdelight:bayberry_soup",
    "fruitsdelight:mangosteen_tea",
    "fruitsdelight:lychee_cherry_tea",
    "fruitsdelight:cranberry_cookie",
    "abnormals_delight:mulberry_cookie",
    "abnormals_delight:maple_cookie",
    "farmersdelight:chocolate_pie_slice",
    "create:bar_of_chocolate",
    "supplementaries:candy",
    "create:chocolate_glazed_berries",
    "endersdelight:strange_eclair",
    "delightful:salmonberry_pie_slice",
    "galospheric_delight:amethyst_pie_slice",
    "fruitsdelight:fig_tart",
    "fruitsdelight:lemon_tart",
    "fruitsdelight:durian_pie",
    "farmersdelight:apple_pie_slice",
    "delightful:passion_fruit_tart_slice",
    "delightful:mulberry_pie_slice",
    "delightful:pumpkin_pie_slice",
    "minecraft:pumpkin_pie",
    "farmersrespite:rose_hip_pie_slice",
    "farmersdelight:chocolate_pie",
    "fruitsdelight:blueberry_muffin",
    "fruitsdelight:cranberry_muffin",
    "galospheric_delight:lumiere_pie_slice",
    "galospheric_delight:allurite_pie_slice",
    "fruitsdelight:fig_pudding_slice",
    "farmersrespite:coffee_cake_slice",
    "create:sweet_roll",
    "delightful:baklava_slice"
  ],
  "effects": [
    {
      "duration_type": "fixed",
      "effect_type": "nutrient_multiplier",
      "effect_id": "sugars",
      "value": -0.5,
      "duration_ticks": 12000
    }
  ]
}
