{
  "name": "Для травоядных",
  "advancement": "offseason:offseason_tab/bonus_herbivore",
  "active_effect_text": "Перейди на траву",
  "flag": "-o",
  "threshold": 5,
  "hide_activation_message": false,
  "require_unique": true,
  "tooltip_icon": "🌿",
  "tooltip_icon_color": "green",
  "items": [
    "farmersdelight:vegetable_noodles",
    "farmersdelight:vegetable_soup",
    "culturaldelights:eggplant_parmesan",
    "culturaldelights:eggplant_burger",
    "culturaldelights:poached_eggplants",
    "farmersdelight:mixed_salad",
    "culturaldelights:empanada",
    "culturaldelights:avocado_toast",
    "culturaldelights:smoked_cut_eggplant",
    "miners_delight:pasta_with_veggieballs",
    "miners_delight:vegan_hamburger",
    "miners_delight:vegan_wrap",
    "miners_delight:vegan_steak_and_potatoes",
    "farmersdelight:fruit_salad"
  ],
  "effects": [
    {
      "duration_type": "until_death",
      "effect_type": "mob_effect",
      "effect_id": "minecraft:weakness",
      "amplifier": 0,
      "cancel_on_groups": [
        "champion_breakfast",
        "sacred_food"
      ]
    },
    {
      "duration_type": "until_death_intermittent",
      "effect_type": "mob_effect",
      "effect_id": "minecraft:nausea",
      "amplifier": 0,
      "interval_active_ticks": [
        100,
        100
      ],
      "interval_pause_ticks": [
        600,
        1200
      ],
      "cancel_on_groups": [
        "champion_breakfast",
        "sacred_food"
      ]
    }
  ]
}