{
  "name": "mixed",
  "hide_activation_message": true,
  "items": [
    "minecraft:air"
  ],
  "threshold": 0,
  "require_unique": false,
  "effects": [
    {
      "type": "until_death",
      "effect_type": "health",
      "effect_id": "health",
      "value": 1
    },
    {
      "type": "fixed",
      "effect_type": "health",
      "effect_id": "health",
      "value": 2,
      "duration_ticks": 3,
      "duration_multipliers": {
        "multiplier": 3
      }
    }
  ]
}
